{
  "metric_id": "METRIC-DEMO-ORDER-AMOUNT",
  "metric_name": "订单金额",
  "business_definition": "确认订单按交易日汇总的金额",
  "numerator": "sum(amount)",
  "denominator": "1",
  "calculation_order": ["过滤确认状态", "按交易日聚合", "求和"],
  "multiplier": "1",
  "dimensions": ["trade_date"],
  "data_sources": ["demo.orders"],
  "join_keys": [],
  "filters": ["status = 已确认"],
  "deduplication_key": "order_id",
  "time_range": "需求指定交易日",
  "timezone_or_trade_calendar": "需求指定交易日历",
  "null_rule": "按已确认口径处理",
  "zero_denominator_rule": "不适用",
  "precision": "decimal(18,2)",
  "rounding_position": "汇总后保留两位",
  "aggregation_method": "sum",
  "detail_summary_relation": "明细汇总",
  "formal_simulated_scope": "demo",
  "evidence_sources": ["sanitized-example"],
  "status": "active_confirmed"
}
